<questions 
        xmlns:xsi="http://www.w3.org/2001/XMLSchema-instance" 
        xsi:noNamespaceSchemaLocation="../questions.xsd" 
        category="Samhälle" subcategory="Ekonomi">

  <question>
    <line>Om ett företag kombinerar sina konkurrensmedel kan försäljningen bli högre än om företaget använt konkurrensmedlen var för sig. Vad kallas denna effekt?</line>
    <answers>
      <answer>Synergieffekt</answer>
    </answers>
  </question>

  <question>
    <line>Hur många ägare kan det som lägst vara i ett aktiebolag?</line>
    <hints>
      <line>1</line>
    </hints>
    <answers>
      <answer>1</answer>
      <answer>en</answer>
    </answers>
  </question>

</questions>
