<questions
        xmlns:xsi="http://www.w3.org/2001/XMLSchema-instance"
        xsi:noNamespaceSchemaLocation="../questions.xsd"
        category="Samhälle" subcategory="Juridik">

  <question>
    <line>Vad betyder lex lata (de lege lata)?</line>
    <answers>
      <answer>Gällande rätt</answer>
    </answers>
  </question>

  <question>
    <line>Vad innebär denuntiation?</line>
    <answers>
      <answer>Underättelse</answer>
    </answers>
  </question>

  <question>
    <line>Om någon olovligen tar 1.500 kronor från dig, men i ögonblicket han tar pengarna ångrar sig och lägger tillbaka pengarna, vilket brott har han gjorts sig skyldig?</line>
    <answers>
      <answer>Stöld</answer>
    </answers>
  </question>

  <question>
    <line>Om en domstol sägs vara inkvisitorisk innebär det att den skall...</line>
    <answers>
      <answer>Efterforska sanningen</answer>
    </answers>
  </question>

  <question>
    <line>En talan vid domstol som går ut på att domstolen skall faställa att ett visst rättsförhållande föreligger kallas?</line>
    <answers>
      <answer>Fastställelsetalan</answer>
    </answers>
  </question>

  <question>
    <line>Hur många grundlagar finns det i Sverige?</line>
    <answers>
      <answer>4 st</answer>
    </answers>
  </question>

  <question>
    <line>Nämn en av Sveriges grundlagar.</line>
    <answers>
      <answer>Tryckfrihetsförordningen</answer>
      <answer>Yttrandefrihetsgrundlagen</answer>
      <answer>Regeringsformen</answer>
      <answer>Succesionsordningen</answer>
    </answers>
  </question>

  <question>
    <line>Vad kallas det man ska ha för att låta någon handla å ens vägnar?</line>
    <answers>
      <answer>Fullmakt</answer>
    </answers>
  </question>

  <question>
    <line>Vem stiftar förordningar?</line>
    <answers>
      <answer>Regeringen</answer>
    </answers>
  </question>

  <question>
    <line>Avtal där båda parter är förpliktade av prestationer som uppväger varandra kallas?</line>
    <answers>
      <answer>Onerösa avtal</answer>
    </answers>
  </question>

  <question>
    <line>Vad kallas bland annat lagar, förordningar och föreskrifter med ett samlingsnamn?</line>
    <answers>
      <answer>Författning</answer>
    </answers>
  </question>

  <question>
    <line>Vilket är det högsta beslutande organet i ett aktiebolag?</line>
    <answers>
      <answer>Bolagsstämman</answer>
    </answers>
  </question>

  <question>
    <line>När måste den tilltalade i brottmål avge vittnesed?</line>
    <answers>
      <answer>Aldrig</answer>
    </answers>
  </question>

  <question>
    <line>Juridiken talar ofta om latinets dolus och culpa. Vad betyder de?</line>
    <answers>
      <answer>Uppsåt och vårdslöshet</answer>
    </answers>
  </question>

  <question>
    <line>Vad är lös egendom?</line>
    <answers>
      <answer>Allt som inte är fast egendom</answer>
    </answers>
  </question>

  <question>
    <line>Vad betyder kausualitet?</line>
    <answers>
      <answer>Orsakssamband</answer>
    </answers>
  </question>

  <question>
    <line>Vilken titel har en domare i Högsta domstolen?</line>
    <answers>
      <answer>Justitieråd</answer>
    </answers>
  </question>

  <question>
    <line>Vad kallas den som blir stämd i ett tvistemål?</line>
    <answers>
      <answer>Svarande</answer>
    </answers>
  </question>

  <question>
    <line>Vem stiftar lagar i Sverige?</line>
    <answers>
      <answer>Riksdagen</answer>
    </answers>
  </question>

  <question>
    <line>Vilken lag förkortas PuL?</line>
    <answers>
      <answer>Personuppgiftslagen</answer>
    </answers>
  </question>

  <question>
    <line>Vad kallas förmögenhetsrättigheter som måste respekteras inte enbart av motpart utan även av tredjeman?</line>
    <answers>
      <answer>Sakrätt</answer>
    </answers>
  </question>

  <question>
    <line>Vad heter domstolen som prövar juridiska tvister inom EU?</line>
    <answers>
      <answer>EG-domstolen</answer>
    </answers>
  </question>

  <question>
    <line>Vad betyder jura novit curia?</line>
    <answers>
      <answer>Domstolen känner lagen</answer>
    </answers>
  </question>

  <question>
    <line>Dödstraffet avskaffades i fredstid 1921 men när avskaffades dödstraffet i krigstid?</line>
    <answers>
      <answer>1973</answer>
    </answers>
  </question>

  <question>
    <line>Du har haft hantverkare hemma och får en räkning för arbetet hemskickad. På räkningen står att den ska betalas inom sju dagar. Om inget mer speciellt är avtalat, hur länge kan du vänta med att betala utan att behöva betala någon dröjsmålsränta?</line>
    <answers>
      <answer>En månad</answer>
    </answers>
  </question>

  <question>
    <line>Din sambo avlider. Ni har inga barn. Sambon har två helsyskon som närmaste släktingar. Vem ärver sambons sparade pengar (om inget testamente finns)?</line>
    <answers>
      <answer>Syskonen</answer>
    </answers>
  </question>

  <question>
    <line>Du köper en ny tv i din lokala tv- och radiobutik. Ett par dagar senare upptäcker du att en likadan tv säljs mycket billigare i en affär i närheten. Har du enligt lagen rätt att ångra ditt första köp, lämna tillbaka tvn och få pengarna tillbaka?</line>
    <answers>
      <answer>Nej</answer>
    </answers>
  </question>

  <question>
    <line>Din trettonårige son kastar sten mot en fönsterruta i skolan. Rutan går sönder. Vem är lagligen betalningsskyldig?</line>
    <answers>
      <answer>Sonen</answer>
    </answers>
  </question>

</questions>
